Sheet: Sheet1
A1: DATE: | B1: of:=DATE(2023;12;22) -> 2023-12-22
A2: GENERATING COMPONENT P/N | B2: GEN. COMPONENT DESCRIPTION | C2: VOLTAGE (V) | D2: CURRENT (A) | E2: POWER (W) | F2: NOTES
A3: LP851719JU+PCM+2 WIRES 50MM | B3: BATTERY (200mAh) | E3: 0.74 | F3: 200mA for One Hour of Battery Life, can go higher for more battery draw.
A5: OUT OF DC:DC CONVERTER, 600MA @ 3.3v | C5: 3.3 | D5: 0.6 | E5: of:=IF(OR([.C5]="";[.D5]="");"";[.C5]*[.D5]) -> 1.98
A12: DISSIPATING COMPONENT P/N | B12: DISS. COMPONENT DESCRIPTION | C12: VOLTAGE (V) | D12: CURRENT (A) | E12: POWER (W) | F12: NOTES
A13: XC9236A33CMR-G | B13: DC-DC CONVERTER | C13: N/A | D13: N/A | E13: 0.6 | F13: CHANGED
A14: MAX1811ESA+ | B14: Battery Charger IC Lithium Ion | E14: 1.4 | F14: 1.4W IS WORST CASE, AND WILL ONLY BE ON WHEN USB POWER IS CONNECTED, DOESNT DRAW FROM BATTERY.
A16: 24155 | B16: 1.28 Inch 240x240p Screen Module /w Capacative Touch Sensor | C16: 3.3 | D16: 0.0332 | E16: of:=IF(OR([.C16]="";[.D16]="");"";[.C16]*[.D16]) -> 0.10956
A17: ESP32-WROOM-32E-N4 | B17: ESP32 Module /w PCB Antenna | C17: 3.3 | D17: 0.5 | E17: of:=IF(OR([.C17]="";[.D17]="");"";[.C17]*[.D17]) -> 1.65 | F17: this is worst case? Will probably draw around 250+ mAH. Need a bigger battery and DC-DC converter
A19: TLV840MAPL36DBVRQ1 | B19: Battery Supervisor IC | C19: 3.3 | D19: 0.002 | E19: of:=IF(OR([.C19]="";[.D19]="");"";[.C19]*[.D19]) -> 0.0066
A20: DMC2400UV-7 | B20: MOSFET N/P 2 CHANNEL PAIR IC | E20: 0.001 | F20: Bumped up, both transistors + voltage divider taken into account.
A21: LSM6DSMTR | B21: IMU ACCEL/GYRO I2C/SPI IC | C21: 3.3 | D21: 0.065 | E21: of:=IF(OR([.C21]="";[.D21]="");"";[.C21]*[.D21]) -> 0.2145 | F21: 65mA in High Performance Mode, 0.4mA in Normal, can also go into a Lower Power Mode
A22: LPS22DFTR | B22: Pressure Sensor | C22: 3.3 | D22: 0.000032 | E22: of:=IF(OR([.C22]="";[.D22]="");"";[.C22]*[.D22]) -> 0.0001056
A24: R20 | B24: 10K RESISTOR | E24: of:=(3.3^2)/10000 -> 0.001089
A25: R10 | B25: 1K RESISTOR | E25: of:=(3.3^2)/1000 -> 0.01089
A26: R11 | B26: 1K RESISTOR | E26: of:=(3.3^2)/1000 -> 0.01089
A27: R17 | B27: 10K RESISTOR | E27: of:=(3.3^2)/10000 -> 0.001089
A30: TOTAL POWER DISSIPATION | D30: of:=SUM([.D13:.D27]) -> 0.600232 | E30: of:=SUM([.E13:.E27]) -> 4.0057236
A31: TOTAL POWER DISSIPATION (BATTERY DRAW ONLY) | D31: of:=SUM([.D16:.D27]) -> 0.600232 | E31: of:=SUM([.E16:.E27]) -> 2.0057236
A38: NET POWER ANALYSIS | E38: POWER (W) | F38: NOTES